{
  "schemaVersion": 5,
  "sessionId": "00000000-0000-4000-8000-000000000000",
  "project": "project",
  "feature": null,
  "task": null,
  "runtime": {
    "system": "codex",
    "ids": ["runtime-id"]
  },
  "startedAt": "2000-01-01T00:00:00Z",
  "finishedAt": null,
  "git": {
    "repo": null,
    "baseBranch": "develop",
    "branch": "session-branch",
    "worktreePath": "/absolute/worktree",
    "issue": null,
    "pullRequest": null
  },
  "settings": {
    "workflow": {
      "ideation": {"maxIterations": 3},
      "planning": {"maxIterations": 3},
      "execution": {"maxIterations": 3},
      "wrap-up": {"maxIterations": 3}
    },
    "models": {
      "claude": {
        "manager": "opus",
        "leader": "opus",
        "executor": "opus",
        "evaluator": "opus",
        "assistant": "sonnet"
      },
      "codex": {
        "manager": "gpt-5.6-sol",
        "leader": "gpt-5.6-sol",
        "executor": "gpt-5.6-sol",
        "evaluator": "gpt-5.6-sol",
        "assistant": "gpt-5.6-sol"
      }
    },
    "git": {
      "publication": "local",
      "createIssue": false,
      "draftPullRequest": false
    }
  },
  "outcome": null
}
